No,;Time;;Source;Destination;Protocol;Length;Info;;;Time 1;Time 2;;Delay1;;Delay 2;;Jitter
1;0;;104,22,1,235;192,168,100,98;TCP;54;443  >  56799 [FIN, ACK] Seq=1 Ack=1 Win=67 Len=0;;;0;0,000102;;0,000102;;0,016524;;0,016422
2;0,000102;;192,168,100,98;104,22,1,235;TCP;54;56799  >  443 [ACK] Seq=1 Ack=4294966412 Win=513 Len=0;;;0,000102;0,016626;;0,016524;;0,000208;;0,016316
3;0,016626;;104,22,1,235;192,168,100,98;TCP;939;[TCP Retransmission] 443  >  56799 [PSH, ACK] Seq=4294966412 Ack=1 Win=67 Len=885;;;0,016626;0,016834;;0,000208;;0,000753;;0,000545
4;0,016834;;192,168,100,98;104,22,1,235;TCP;54;56799  >  443 [ACK] Seq=1 Ack=2 Win=510 Len=0;;;0,016834;0,017587;;0,000753;;0,061964;;0,061211
5;0,017587;;192,168,100,98;104,22,1,235;TCP;54;56799  >  443 [FIN, ACK] Seq=1 Ack=2 Win=510 Len=0;;;0,017587;0,079551;;0,061964;;0,050817;;0,011147
6;0,079551;;192,168,100,98;104,22,1,235;TCP;66;56800  >  443 [SYN] Seq=0 Win=64240 Len=0 MSS=1460 WS=256 SACK_PERM=1;;;0,079551;0,130368;;0,050817;;0,000226;;0,050591
7;0,130368;;104,22,1,235;192,168,100,98;TCP;66;443  >  56800 [SYN, ACK] Seq=0 Ack=1 Win=65535 Len=0 MSS=1400 SACK_PERM=1 WS=1024;;;0,130368;0,130594;;0,000226;;0,001032;;0,000806
8;0,130594;;192,168,100,98;104,22,1,235;TCP;54;56800  >  443 [ACK] Seq=1 Ack=1 Win=131584 Len=0;;;0,130594;0,131626;;0,001032;;0,004257;;0,003225
9;0,131626;;192,168,100,98;104,22,1,235;TLSv1;372;Client Hello;;;0,131626;0,135883;;0,004257;;5,00E-05;;0,004207
10;0,135883;;104,22,1,235;192,168,100,98;TCP;54;[TCP Retransmission] 443  >  56799 [FIN, ACK] Seq=1 Ack=1 Win=67 Len=0;;;0,135883;0,135933;;5,00E-05;;0,047034;;0,046984
11;0,135933;;192,168,100,98;104,22,1,235;TCP;54;[TCP Dup ACK 4#1] 56799  >  443 [ACK] Seq=2 Ack=2 Win=510 Len=0;;;0,135933;0,182967;;0,047034;;0,013645;;0,033389
12;0,182967;;104,22,1,235;192,168,100,98;TCP;54;443  >  56800 [ACK] Seq=1 Ack=319 Win=67584 Len=0;;;0,182967;0,196612;;0,013645;;0,002217;;0,011428
13;0,196612;;104,22,1,235;192,168,100,98;TLSv1;177;Server Hello, Change Cipher Spec, Encrypted Handshake Message;;;0,196612;0,198829;;0,002217;;0,050609;;0,048392
14;0,198829;;192,168,100,98;104,22,1,235;TLSv1;699;Change Cipher Spec, Encrypted Handshake Message, Application Data, Application Data;;;0,198829;0,249438;;0,050609;;0,000104;;0,050505
15;0,249438;;104,22,1,235;192,168,100,98;TCP;56;443  >  56800 [ACK] Seq=124 Ack=964 Win=68608 Len=0;;;0,249438;0,249542;;0,000104;;0,050286;;0,050182
16;0,249542;;192,168,100,98;104,22,1,235;TLSv1;160;Application Data, Application Data;;;0,249542;0,299828;;0,050286;;0,019641;;0,030645
17;0,299828;;104,22,1,235;192,168,100,98;TCP;56;443  >  56800 [ACK] Seq=124 Ack=1070 Win=68608 Len=0;;;0,299828;0,319469;;0,019641;;0,208236;;0,188595
18;0,319469;;192,168,100,98;104,22,1,235;TCP;54;[TCP Retransmission] 56799  >  443 [FIN, ACK] Seq=1 Ack=2 Win=510 Len=0;;;0,319469;0,527705;;0,208236;;0,000104;;0,208132
19;0,527705;;104,22,1,235;192,168,100,98;TCP;54;[TCP Previous segment not captured] 443  >  56800 [FIN, ACK] Seq=1025 Ack=1070 Win=68608 Len=0;;;0,527705;0,527809;;0,000104;;0,019112;;0,019008
20;0,527809;;192,168,100,98;104,22,1,235;TCP;54;[TCP Dup ACK 14#1] 56800  >  443 [ACK] Seq=1070 Ack=124 Win=131328 Len=0;;;0,527809;0,546921;;0,019112;;0,00019;;0,018922
21;0,546921;;104,22,1,235;192,168,100,98;TCP;955;[TCP Out-Of-Order] 443  >  56800 [PSH, ACK] Seq=124 Ack=1070 Win=68608 Len=901;;;0,546921;0,547111;;0,00019;;0,000694;;0,000504
22;0,547111;;192,168,100,98;104,22,1,235;TCP;54;56800  >  443 [ACK] Seq=1070 Ack=1026 Win=130560 Len=0;;;0,547111;0,547805;;0,000694;;0,045483;;0,044789
23;0,547805;;192,168,100,98;104,22,1,235;TCP;54;56800  >  443 [FIN, ACK] Seq=1070 Ack=1026 Win=130560 Len=0;;;0,547805;0,593288;;0,045483;;0,008781;;0,036702
24;0,593288;;192,168,100,98;104,22,1,235;TCP;66;56801  >  443 [SYN] Seq=0 Win=64240 Len=0 MSS=1460 WS=256 SACK_PERM=1;;;0,593288;0,602069;;0,008781;;0,058151;;0,04937
25;0,602069;;104,22,1,235;192,168,100,98;TCP;56;443  >  56800 [ACK] Seq=1026 Ack=1071 Win=68608 Len=0;;;0,602069;0,66022;;0,058151;;0,000221;;0,05793
27;0,66022;;104,22,1,235;192,168,100,98;TCP;66;443  >  56801 [SYN, ACK] Seq=0 Ack=1 Win=65535 Len=0 MSS=1400 SACK_PERM=1 WS=1024;;;0,66022;0,660441;;0,000221;;0,000999;;0,000778
28;0,660441;;192,168,100,98;104,22,1,235;TCP;54;56801  >  443 [ACK] Seq=1 Ack=1 Win=131584 Len=0;;;0,660441;0,66144;;0,000999;;0,059239;;0,05824
29;0,66144;;192,168,100,98;104,22,1,235;TLSv1;372;Client Hello;;;0,66144;0,720679;;0,059239;;0,015665;;0,043574
30;0,720679;;104,22,1,235;192,168,100,98;TCP;54;443  >  56801 [ACK] Seq=1 Ack=319 Win=67584 Len=0;;;0,720679;0,736344;;0,015665;;0,001132;;0,014533
31;0,736344;;104,22,1,235;192,168,100,98;TLSv1;177;Server Hello, Change Cipher Spec, Encrypted Handshake Message;;;0,736344;0,737476;;0,001132;;0,059395;;0,058263
32;0,737476;;192,168,100,98;104,22,1,235;TLSv1;699;Change Cipher Spec, Encrypted Handshake Message, Application Data, Application Data;;;0,737476;0,796871;;0,059395;;7,60E-05;;0,059319
33;0,796871;;104,22,1,235;192,168,100,98;TCP;56;443  >  56801 [ACK] Seq=124 Ack=964 Win=68608 Len=0;;;0,796871;0,796947;;7,60E-05;;0,059164;;0,059088
34;0,796947;;192,168,100,98;104,22,1,235;TLSv1;160;Application Data, Application Data;;;0,796947;0,856111;;0,059164;;0,065579;;0,006415
35;0,856111;;104,22,1,235;192,168,100,98;TCP;56;443  >  56801 [ACK] Seq=124 Ack=1070 Win=68608 Len=0;;;0,856111;0,92169;;0,065579;;0,063982;;0,001597
37;0,92169;;192,168,100,98;104,22,1,235;TCP;54;[TCP Retransmission] 56799  >  443 [FIN, ACK] Seq=1 Ack=2 Win=510 Len=0;;;0,92169;0,985672;;0,063982;;0,117414;;0,053432
38;0,985672;;104,22,1,235;192,168,100,98;TCP;56;443  >  56799 [ACK] Seq=2 Ack=2 Win=67 Len=0;;;0,985672;1,103086;;0,117414;;0,00011;;0,117304
39;1.103.086;1,103086;104,22,1,235;192,168,100,98;TCP;54;[TCP Previous segment not captured] 443  >  56801 [FIN, ACK] Seq=1025 Ack=1070 Win=68608 Len=0;;;1,103086;1,103196;;0,00011;;0,01336;;0,01325
40;1.103.196;1,103196;192,168,100,98;104,22,1,235;TCP;54;[TCP Dup ACK 32#1] 56801  >  443 [ACK] Seq=1070 Ack=124 Win=131328 Len=0;;;1,103196;1,116556;;0,01336;;0,000201;;0,013159
41;1.116.556;1,116556;104,22,1,235;192,168,100,98;TCP;955;[TCP Out-Of-Order] 443  >  56801 [PSH, ACK] Seq=124 Ack=1070 Win=68608 Len=901;;;1,116556;1,116757;;0,000201;;0,000799;;0,000598
42;1.116.757;1,116757;192,168,100,98;104,22,1,235;TCP;54;56801  >  443 [ACK] Seq=1070 Ack=1026 Win=130560 Len=0;;;1,116757;1,117556;;0,000799;;0,062941;;0,062142
43;1.117.556;1,117556;192,168,100,98;104,22,1,235;TCP;54;56801  >  443 [FIN, ACK] Seq=1070 Ack=1026 Win=130560 Len=0;;;1,117556;1,180497;;0,062941;;0,003725;;0,059216
45;1.180.497;1,180497;104,22,1,235;192,168,100,98;TCP;56;443  >  56801 [ACK] Seq=1026 Ack=1071 Win=68608 Len=0;;;1,180497;1,184222;;0,003725;;0,080342;;0,076617
46;1.184.222;1,184222;192,168,100,98;104,22,1,235;TCP;66;56802  >  443 [SYN] Seq=0 Win=64240 Len=0 MSS=1460 WS=256 SACK_PERM=1;;;1,184222;1,264564;;0,080342;;0,000237;;0,080105
47;1.264.564;1,264564;104,22,1,235;192,168,100,98;TCP;66;443  >  56802 [SYN, ACK] Seq=0 Ack=1 Win=65535 Len=0 MSS=1400 SACK_PERM=1 WS=1024;;;1,264564;1,264801;;0,000237;;0,000947;;0,00071
48;1.264.801;1,264801;192,168,100,98;104,22,1,235;TCP;54;56802  >  443 [ACK] Seq=1 Ack=1 Win=131584 Len=0;;;1,264801;1,265748;;0,000947;;0,090298;;0,089351
49;1.265.748;1,265748;192,168,100,98;104,22,1,235;TLSv1;372;Client Hello;;;1,265748;1,356046;;0,090298;;0,023082;;0,067216
50;1.356.046;1,356046;104,22,1,235;192,168,100,98;TCP;54;443  >  56802 [ACK] Seq=1 Ack=319 Win=67584 Len=0;;;1,356046;1,379128;;0,023082;;0,002167;;0,020915
51;1.379.128;1,379128;104,22,1,235;192,168,100,98;TLSv1;177;Server Hello, Change Cipher Spec, Encrypted Handshake Message;;;1,379128;1,381295;;0,002167;;0,069749;;0,067582
52;1.381.295;1,381295;192,168,100,98;104,22,1,235;TLSv1;699;Change Cipher Spec, Encrypted Handshake Message, Application Data, Application Data;;;1,381295;1,451044;;0,069749;;0,000106;;0,069643
54;1.451.044;1,451044;104,22,1,235;192,168,100,98;TCP;56;443  >  56802 [ACK] Seq=124 Ack=964 Win=68608 Len=0;;;1,451044;1,45115;;0,000106;;0,059387;;0,059281
55;1.451.150;1,45115;192,168,100,98;104,22,1,235;TLSv1;160;Application Data, Application Data;;;1,45115;1,510537;;0,059387;;0,230351;;0,170964
56;1.510.537;1,510537;104,22,1,235;192,168,100,98;TCP;56;443  >  56802 [ACK] Seq=124 Ack=1070 Win=68608 Len=0;;;1,510537;1,740888;;0,230351;;0,000122;;0,230229
58;1.740.888;1,740888;104,22,1,235;192,168,100,98;TCP;54;[TCP Previous segment not captured] 443  >  56802 [FIN, ACK] Seq=1025 Ack=1070 Win=68608 Len=0;;;1,740888;1,74101;;0,000122;;0,01564;;0,015518
59;1.741.010;1,74101;192,168,100,98;104,22,1,235;TCP;54;[TCP Dup ACK 52#1] 56802  >  443 [ACK] Seq=1070 Ack=124 Win=131328 Len=0;;;1,74101;1,75665;;0,01564;;0,000204;;0,015436
60;1.756.650;1,75665;104,22,1,235;192,168,100,98;TCP;955;[TCP Out-Of-Order] 443  >  56802 [PSH, ACK] Seq=124 Ack=1070 Win=68608 Len=901;;;1,75665;1,756854;;0,000204;;0,000769;;0,000565
61;1.756.854;1,756854;192,168,100,98;104,22,1,235;TCP;54;56802  >  443 [ACK] Seq=1070 Ack=1026 Win=130560 Len=0;;;1,756854;1,757623;;0,000769;;0,052617;;0,051848
62;1.757.623;1,757623;192,168,100,98;104,22,1,235;TCP;54;56802  >  443 [FIN, ACK] Seq=1070 Ack=1026 Win=130560 Len=0;;;1,757623;1,81024;;0,052617;;0,045649;;0,006968
63;1.810.240;1,81024;192,168,100,98;104,22,1,235;TCP;66;56803  >  443 [SYN] Seq=0 Win=64240 Len=0 MSS=1460 WS=256 SACK_PERM=1;;;1,81024;1,855889;;0,045649;;0,055172;;0,009523
64;1.855.889;1,855889;104,22,1,235;192,168,100,98;TCP;56;443  >  56802 [ACK] Seq=1026 Ack=1071 Win=68608 Len=0;;;1,855889;1,911061;;0,055172;;0,000243;;0,054929
65;1.911.061;1,911061;104,22,1,235;192,168,100,98;TCP;66;443  >  56803 [SYN, ACK] Seq=0 Ack=1 Win=65535 Len=0 MSS=1400 SACK_PERM=1 WS=1024;;;1,911061;1,911304;;0,000243;;0,000992;;0,000749
66;1.911.304;1,911304;192,168,100,98;104,22,1,235;TCP;54;56803  >  443 [ACK] Seq=1 Ack=1 Win=131584 Len=0;;;1,911304;1,912296;;0,000992;;0,107275;;0,106283
67;1.912.296;1,912296;192,168,100,98;104,22,1,235;TLSv1;372;Client Hello;;;1,912296;2,019571;;0,107275;;0,009913;;0,097362
69;2.019.571;2,019571;104,22,1,235;192,168,100,98;TCP;54;443  >  56803 [ACK] Seq=1 Ack=319 Win=67584 Len=0;;;2,019571;2,029484;;0,009913;;0,001937;;0,007976
70;2.029.484;2,029484;104,22,1,235;192,168,100,98;TLSv1;177;Server Hello, Change Cipher Spec, Encrypted Handshake Message;;;2,029484;2,031421;;0,001937;;0,104729;;0,102792
72;2.031.421;2,031421;192,168,100,98;104,22,1,235;TLSv1;699;Change Cipher Spec, Encrypted Handshake Message, Application Data, Application Data;;;2,031421;2,13615;;0,104729;;0,000101;;0,104628
73;2.136.150;2,13615;104,22,1,235;192,168,100,98;TCP;56;443  >  56803 [ACK] Seq=124 Ack=964 Win=68608 Len=0;;;2,13615;2,136251;;0,000101;;0,081674;;0,081573
74;2.136.251;2,136251;192,168,100,98;104,22,1,235;TLSv1;160;Application Data, Application Data;;;2,136251;2,217925;;0,081674;;0,208821;;0,127147
76;2.217.925;2,217925;104,22,1,235;192,168,100,98;TCP;56;443  >  56803 [ACK] Seq=124 Ack=1070 Win=68608 Len=0;;;2,217925;2,426746;;0,208821;;0,000118;;0,208703
77;2.426.746;2,426746;104,22,1,235;192,168,100,98;TCP;54;[TCP Previous segment not captured] 443  >  56803 [FIN, ACK] Seq=1025 Ack=1070 Win=68608 Len=0;;;2,426746;2,426864;;0,000118;;0,01986;;0,019742
78;2.426.864;2,426864;192,168,100,98;104,22,1,235;TCP;54;[TCP Dup ACK 72#1] 56803  >  443 [ACK] Seq=1070 Ack=124 Win=131328 Len=0;;;2,426864;2,446724;;0,01986;;0,000178;;0,019682
80;2.446.724;2,446724;104,22,1,235;192,168,100,98;TCP;955;[TCP Out-Of-Order] 443  >  56803 [PSH, ACK] Seq=124 Ack=1070 Win=68608 Len=901;;;2,446724;2,446902;;0,000178;;0,00094;;0,000762
81;2.446.902;2,446902;192,168,100,98;104,22,1,235;TCP;54;56803  >  443 [ACK] Seq=1070 Ack=1026 Win=130560 Len=0;;;2,446902;2,447842;;0,00094;;0,042835;;0,041895
82;2.447.842;2,447842;192,168,100,98;104,22,1,235;TCP;54;56803  >  443 [FIN, ACK] Seq=1070 Ack=1026 Win=130560 Len=0;;;2,447842;2,490677;;0,042835;;0,078685;;0,03585
83;2.490.677;2,490677;192,168,100,98;104,22,1,235;TCP;66;56804  >  443 [SYN] Seq=0 Win=64240 Len=0 MSS=1460 WS=256 SACK_PERM=1;;;2,490677;2,569362;;0,078685;;0,024363;;0,054322
84;2.569.362;2,569362;104,22,1,235;192,168,100,98;TCP;56;443  >  56803 [ACK] Seq=1026 Ack=1071 Win=68608 Len=0;;;2,569362;2,593725;;0,024363;;0,000394;;0,023969
85;2.593.725;2,593725;192,168,100,98;74,125,68,91;TLSv1,2;805;Application Data;;;2,593725;2,594119;;0,000394;;0,026723;;0,026329
86;2.594.119;2,594119;192,168,100,98;74,125,68,91;TLSv1,2;93;Application Data;;;2,594119;2,620842;;0,026723;;0,000253;;0,02647
87;2.620.842;2,620842;104,22,1,235;192,168,100,98;TCP;66;443  >  56804 [SYN, ACK] Seq=0 Ack=1 Win=65535 Len=0 MSS=1400 SACK_PERM=1 WS=1024;;;2,620842;2,621095;;0,000253;;0,001011;;0,000758
88;2.621.095;2,621095;192,168,100,98;104,22,1,235;TCP;54;56804  >  443 [ACK] Seq=1 Ack=1 Win=131584 Len=0;;;2,621095;2,622106;;0,001011;;0,143166;;0,142155
89;2.622.106;2,622106;192,168,100,98;104,22,1,235;TLSv1;372;Client Hello;;;2,622106;2,765272;;0,143166;;0,01423;;0,128936
91;2.765.272;2,765272;192,168,100,98;74,125,68,119;TCP;55;56446  >  443 [ACK] Seq=1 Ack=1 Win=2051 Len=1 [TCP segment of a reassembled PDU];;;2,765272;2,779502;;0,01423;;0,045231;;0,031001
92;2.779.502;2,779502;74,125,68,119;192,168,100,98;TCP;66;443  >  56446 [ACK] Seq=1 Ack=2 Win=443 Len=0 SLE=1 SRE=2;;;2,779502;2,824733;;0,045231;;0,179473;;0,134242
93;2.824.733;2,824733;192,168,100,98;74,125,68,91;TCP;844;[TCP Retransmission] 56441  >  443 [PSH, ACK] Seq=1 Ack=1 Win=4134 Len=790;;;2,824733;3,004206;;0,179473;;0,060596;;0,118877
95;3.004.206;3,004206;192,168,100,98;104,22,1,235;TCP;372;[TCP Retransmission] 56804  >  443 [PSH, ACK] Seq=1 Ack=1 Win=131584 Len=318;;;3,004206;3,064802;;0,060596;;0,011638;;0,048958
96;3.064.802;3,064802;104,22,1,235;192,168,100,98;TCP;54;443  >  56804 [ACK] Seq=1 Ack=319 Win=67584 Len=0;;;3,064802;3,07644;;0,011638;;0,001753;;0,009885
97;3.076.440;3,07644;104,22,1,235;192,168,100,98;TLSv1;177;Server Hello, Change Cipher Spec, Encrypted Handshake Message;;;3,07644;3,078193;;0,001753;;0,051266;;0,049513
98;3.078.193;3,078193;192,168,100,98;104,22,1,235;TLSv1;699;Change Cipher Spec, Encrypted Handshake Message, Application Data, Application Data;;;3,078193;3,129459;;0,051266;;0,008935;;0,042331
99;3.129.459;3,129459;192,168,100,98;74,125,68,91;TCP;844;[TCP Retransmission] 56441  >  443 [PSH, ACK] Seq=1 Ack=1 Win=4134 Len=790;;;3,129459;3,138394;;0,008935;;8,40E-05;;0,008851
100;3.138.394;3,138394;104,22,1,235;192,168,100,98;TCP;56;443  >  56804 [ACK] Seq=124 Ack=964 Win=68608 Len=0;;;3,138394;3,138478;;8,40E-05;;0,056989;;0,056905
101;3.138.478;3,138478;192,168,100,98;104,22,1,235;TLSv1;160;Application Data, Application Data;;;3,138478;3,195467;;0,056989;;0,238715;;0,181726
102;3.195.467;3,195467;104,22,1,235;192,168,100,98;TCP;56;443  >  56804 [ACK] Seq=124 Ack=1070 Win=68608 Len=0;;;3,195467;3,434182;;0,238715;;0,000113;;0,238602
104;3.434.182;3,434182;104,22,1,235;192,168,100,98;TCP;54;[TCP Previous segment not captured] 443  >  56804 [FIN, ACK] Seq=1009 Ack=1070 Win=68608 Len=0;;;3,434182;3,434295;;0,000113;;0,011986;;0,011873
105;3.434.295;3,434295;192,168,100,98;104,22,1,235;TCP;54;[TCP Dup ACK 98#1] 56804  >  443 [ACK] Seq=1070 Ack=124 Win=131328 Len=0;;;3,434295;3,446281;;0,011986;;0,000104;;0,011882
106;3.446.281;3,446281;104,22,1,235;192,168,100,98;TCP;939;[TCP Out-Of-Order] 443  >  56804 [PSH, ACK] Seq=124 Ack=1070 Win=68608 Len=885;;;3,446281;3,446385;;0,000104;;0,000454;;0,00035
107;3.446.385;3,446385;192,168,100,98;104,22,1,235;TCP;54;56804  >  443 [ACK] Seq=1070 Ack=1010 Win=130560 Len=0;;;3,446385;3,446839;;0,000454;;0,040533;;0,040079
108;3.446.839;3,446839;192,168,100,98;104,22,1,235;TCP;54;56804  >  443 [FIN, ACK] Seq=1070 Ack=1010 Win=130560 Len=0;;;3,446839;3,487372;;0,040533;;0,017937;;0,022596
110;3.487.372;3,487372;192,168,100,98;104,22,1,235;TCP;66;56805  >  443 [SYN] Seq=0 Win=64240 Len=0 MSS=1460 WS=256 SACK_PERM=1;;;3,487372;3,505309;;0,017937;;0,034265;;0,016328
111;3.505.309;3,505309;104,22,1,235;192,168,100,98;TCP;56;443  >  56804 [ACK] Seq=1010 Ack=1071 Win=68608 Len=0;;;3,505309;3,539574;;0,034265;;0,000238;;0,034027
112;3.539.574;3,539574;104,22,1,235;192,168,100,98;TCP;66;443  >  56805 [SYN, ACK] Seq=0 Ack=1 Win=65535 Len=0 MSS=1400 SACK_PERM=1 WS=1024;;;3,539574;3,539812;;0,000238;;0,00095;;0,000712
113;3.539.812;3,539812;192,168,100,98;104,22,1,235;TCP;54;56805  >  443 [ACK] Seq=1 Ack=1 Win=131584 Len=0;;;3,539812;3,540762;;0,00095;;0,050729;;0,049779
114;3.540.762;3,540762;192,168,100,98;104,22,1,235;TLSv1;372;Client Hello;;;3,540762;3,591491;;0,050729;;0,01738;;0,033349
115;3.591.491;3,591491;104,22,1,235;192,168,100,98;TCP;54;443  >  56805 [ACK] Seq=1 Ack=319 Win=67584 Len=0;;;3,591491;3,608871;;0,01738;;0,002283;;0,015097
116;3.608.871;3,608871;104,22,1,235;192,168,100,98;TLSv1;177;Server Hello, Change Cipher Spec, Encrypted Handshake Message;;;3,608871;3,611154;;0,002283;;0,050844;;0,048561
117;3.611.154;3,611154;192,168,100,98;104,22,1,235;TLSv1;699;Change Cipher Spec, Encrypted Handshake Message, Application Data, Application Data;;;3,611154;3,661998;;0,050844;;0,000117;;0,050727
118;3.661.998;3,661998;104,22,1,235;192,168,100,98;TCP;56;443  >  56805 [ACK] Seq=124 Ack=964 Win=68608 Len=0;;;3,661998;3,662115;;0,000117;;0,049763;;0,049646
119;3.662.115;3,662115;192,168,100,98;104,22,1,235;TLSv1;160;Application Data, Application Data;;;3,662115;3,711878;;0,049763;;0,019603;;0,03016
120;3.711.878;3,711878;104,22,1,235;192,168,100,98;TCP;56;443  >  56805 [ACK] Seq=124 Ack=1070 Win=68608 Len=0;;;3,711878;3,731481;;0,019603;;0,016503;;0,0031
121;3.731.481;3,731481;192,168,100,98;74,125,68,91;TCP;844;[TCP Retransmission] 56441  >  443 [PSH, ACK] Seq=1 Ack=1 Win=4134 Len=790;;;3,731481;3,747984;;0,016503;;0,001947;;0,014556
122;3.747.984;3,747984;74,125,68,91;192,168,100,98;TCP;54;443  >  56441 [ACK] Seq=1 Ack=791 Win=1640 Len=0;;;3,747984;3,749931;;0,001947;;0;;0,001947
123;3.749.931;3,749931;74,125,68,91;192,168,100,98;TLSv1,2;93;Application Data;;;3,749931;3,749931;;0;;0,000133;;0,000133
124;3.749.931;3,749931;74,125,68,91;192,168,100,98;TLSv1,2;125;Application Data;;;3,749931;3,750064;;0,000133;;0,017049;;0,016916
125;3.750.064;3,750064;192,168,100,98;74,125,68,91;TCP;54;56441  >  443 [ACK] Seq=791 Ack=111 Win=4134 Len=0;;;3,750064;3,767113;;0,017049;;0;;0,017049
126;3.767.113;3,767113;74,125,68,91;192,168,100,98;TLSv1,2;85;Application Data;;;3,767113;3,767113;;0;;0,000198;;0,000198
127;3.767.113;3,767113;74,125,68,91;192,168,100,98;TLSv1,2;93;Application Data;;;3,767113;3,767311;;0,000198;;0,000772;;0,000574
128;3.767.311;3,767311;192,168,100,98;74,125,68,91;TCP;54;56441  >  443 [ACK] Seq=791 Ack=181 Win=4133 Len=0;;;3,767311;3,768083;;0,000772;;0,018606;;0,017834
129;3.768.083;3,768083;192,168,100,98;74,125,68,91;TLSv1,2;93;Application Data;;;3,768083;3,786689;;0,018606;;0,144441;;0,125835
130;3.786.689;3,786689;74,125,68,91;192,168,100,98;TCP;56;443  >  56441 [ACK] Seq=181 Ack=830 Win=1640 Len=0;;;3,786689;3,93113;;0,144441;;0,000135;;0,144306
131;3.931.130;3,93113;104,22,1,235;192,168,100,98;TCP;54;[TCP Previous segment not captured] 443  >  56805 [FIN, ACK] Seq=1025 Ack=1070 Win=68608 Len=0;;;3,93113;3,931265;;0,000135;;0,015121;;0,014986
132;3.931.265;3,931265;192,168,100,98;104,22,1,235;TCP;54;[TCP Dup ACK 117#1] 56805  >  443 [ACK] Seq=1070 Ack=124 Win=131328 Len=0;;;3,931265;3,946386;;0,015121;;0,000211;;0,01491
133;3.946.386;3,946386;104,22,1,235;192,168,100,98;TCP;955;[TCP Out-Of-Order] 443  >  56805 [PSH, ACK] Seq=124 Ack=1070 Win=68608 Len=901;;;3,946386;3,946597;;0,000211;;0,001527;;0,001316
134;3.946.597;3,946597;192,168,100,98;104,22,1,235;TCP;54;56805  >  443 [ACK] Seq=1070 Ack=1026 Win=130560 Len=0;;;3,946597;3,948124;;0,001527;;0,049544;;0,048017
135;3.948.124;3,948124;192,168,100,98;104,22,1,235;TCP;54;56805  >  443 [FIN, ACK] Seq=1070 Ack=1026 Win=130560 Len=0;;;3,948124;3,997668;;0,049544;;0,042455;;0,007089
136;3.997.668;3,997668;104,22,1,235;192,168,100,98;TCP;56;443  >  56805 [ACK] Seq=1026 Ack=1071 Win=68608 Len=0;;;3,997668;4,040123;;0,042455;;0,050967;;0,008512
137;4.040.123;4,040123;192,168,100,98;104,22,1,235;TCP;66;56806  >  443 [SYN] Seq=0 Win=64240 Len=0 MSS=1460 WS=256 SACK_PERM=1;;;4,040123;4,09109;;0,050967;;0,000142;;0,050825
138;4.091.090;4,09109;104,22,1,235;192,168,100,98;TCP;66;443  >  56806 [SYN, ACK] Seq=0 Ack=1 Win=65535 Len=0 MSS=1400 SACK_PERM=1 WS=1024;;;4,09109;4,091232;;0,000142;;0,001127;;0,000985
139;4.091.232;4,091232;192,168,100,98;104,22,1,235;TCP;54;56806  >  443 [ACK] Seq=1 Ack=1 Win=131584 Len=0;;;4,091232;4,092359;;0,001127;;0,052644;;0,051517
140;4.092.359;4,092359;192,168,100,98;104,22,1,235;TLSv1;372;Client Hello;;;4,092359;4,145003;;0,052644;;0,011309;;0,041335
141;4.145.003;4,145003;104,22,1,235;192,168,100,98;TCP;54;443  >  56806 [ACK] Seq=1 Ack=319 Win=67584 Len=0;;;4,145003;4,156312;;0,011309;;0,002074;;0,009235
142;4.156.312;4,156312;104,22,1,235;192,168,100,98;TLSv1;177;Server Hello, Change Cipher Spec, Encrypted Handshake Message;;;4,156312;4,158386;;0,002074;;0,050046;;0,047972
143;4.158.386;4,158386;192,168,100,98;104,22,1,235;TLSv1;699;Change Cipher Spec, Encrypted Handshake Message, Application Data, Application Data;;;4,158386;4,208432;;0,050046;;0,000105;;0,049941
144;4.208.432;4,208432;104,22,1,235;192,168,100,98;TCP;56;443  >  56806 [ACK] Seq=124 Ack=964 Win=68608 Len=0;;;4,208432;4,208537;;0,000105;;0,087069;;0,086964
145;4.208.537;4,208537;192,168,100,98;104,22,1,235;TLSv1;160;Application Data, Application Data;;;4,208537;4,295606;;0,087069;;0,22316;;0,136091
146;4.295.606;4,295606;104,22,1,235;192,168,100,98;TCP;56;443  >  56806 [ACK] Seq=124 Ack=1070 Win=68608 Len=0;;;4,295606;4,518766;;0,22316;;0,000117;;0,223043
147;4.518.766;4,518766;104,22,1,235;192,168,100,98;TCP;54;[TCP Previous segment not captured] 443  >  56806 [FIN, ACK] Seq=1025 Ack=1070 Win=68608 Len=0;;;4,518766;4,518883;;0,000117;;0,018226;;0,018109
148;4.518.883;4,518883;192,168,100,98;104,22,1,235;TCP;54;[TCP Dup ACK 143#1] 56806  >  443 [ACK] Seq=1070 Ack=124 Win=131328 Len=0;;;4,518883;4,537109;;0,018226;;0,000188;;0,018038
149;4.537.109;4,537109;104,22,1,235;192,168,100,98;TCP;955;[TCP Out-Of-Order] 443  >  56806 [PSH, ACK] Seq=124 Ack=1070 Win=68608 Len=901;;;4,537109;4,537297;;0,000188;;0,000736;;0,000548
150;4.537.297;4,537297;192,168,100,98;104,22,1,235;TCP;54;56806  >  443 [ACK] Seq=1070 Ack=1026 Win=130560 Len=0;;;4,537297;4,538033;;0,000736;;0,049599;;0,048863
151;4.538.033;4,538033;192,168,100,98;104,22,1,235;TCP;54;56806  >  443 [FIN, ACK] Seq=1070 Ack=1026 Win=130560 Len=0;;;4,538033;4,587632;;0,049599;;0,026192;;0,023407
152;4.587.632;4,587632;104,22,1,235;192,168,100,98;TCP;56;443  >  56806 [ACK] Seq=1026 Ack=1071 Win=68608 Len=0;;;4,587632;4,613824;;0,026192;;0,048804;;0,022612
153;4.613.824;4,613824;192,168,100,98;104,22,1,235;TCP;66;56807  >  443 [SYN] Seq=0 Win=64240 Len=0 MSS=1460 WS=256 SACK_PERM=1;;;4,613824;4,662628;;0,048804;;0,000359;;0,048445
154;4.662.628;4,662628;104,22,1,235;192,168,100,98;TCP;66;443  >  56807 [SYN, ACK] Seq=0 Ack=1 Win=65535 Len=0 MSS=1400 SACK_PERM=1 WS=1024;;;4,662628;4,662987;;0,000359;;0,001018;;0,000659
155;4.662.987;4,662987;192,168,100,98;104,22,1,235;TCP;54;56807  >  443 [ACK] Seq=1 Ack=1 Win=131584 Len=0;;;4,662987;4,664005;;0,001018;;0,049474;;0,048456
156;4.664.005;4,664005;192,168,100,98;104,22,1,235;TLSv1;372;Client Hello;;;4,664005;4,713479;;0,049474;;0,016793;;0,032681
157;4.713.479;4,713479;104,22,1,235;192,168,100,98;TCP;54;443  >  56807 [ACK] Seq=1 Ack=319 Win=67584 Len=0;;;4,713479;4,730272;;0,016793;;0,001742;;0,015051
158;4.730.272;4,730272;104,22,1,235;192,168,100,98;TLSv1;177;Server Hello, Change Cipher Spec, Encrypted Handshake Message;;;4,730272;4,732014;;0,001742;;0,048761;;0,047019
159;4.732.014;4,732014;192,168,100,98;104,22,1,235;TLSv1;699;Change Cipher Spec, Encrypted Handshake Message, Application Data, Application Data;;;4,732014;4,780775;;0,048761;;9,80E-05;;0,048663
160;4.780.775;4,780775;104,22,1,235;192,168,100,98;TCP;56;443  >  56807 [ACK] Seq=124 Ack=964 Win=68608 Len=0;;;4,780775;4,780873;;9,80E-05;;0,048061;;0,047963
161;4.780.873;4,780873;192,168,100,98;104,22,1,235;TLSv1;160;Application Data, Application Data;;;4,780873;4,828934;;0,048061;;0,232923;;0,184862
162;4.828.934;4,828934;104,22,1,235;192,168,100,98;TCP;56;443  >  56807 [ACK] Seq=124 Ack=1070 Win=68608 Len=0;;;4,828934;5,061857;;0,232923;;0,000174;;0,232749
163;5.061.857;5,061857;104,22,1,235;192,168,100,98;TCP;54;[TCP Previous segment not captured] 443  >  56807 [FIN, ACK] Seq=1025 Ack=1070 Win=68608 Len=0;;;5,061857;5,062031;;0,000174;;0,017714;;0,01754
164;5.062.031;5,062031;192,168,100,98;104,22,1,235;TCP;54;[TCP Dup ACK 159#1] 56807  >  443 [ACK] Seq=1070 Ack=124 Win=131328 Len=0;;;5,062031;5,079745;;0,017714;;0,000172;;0,017542
165;5.079.745;5,079745;104,22,1,235;192,168,100,98;TCP;955;[TCP Out-Of-Order] 443  >  56807 [PSH, ACK] Seq=124 Ack=1070 Win=68608 Len=901;;;5,079745;5,079917;;0,000172;;0,000834;;0,000662
166;5.079.917;5,079917;192,168,100,98;104,22,1,235;TCP;54;56807  >  443 [ACK] Seq=1070 Ack=1026 Win=130560 Len=0;;;5,079917;5,080751;;0,000834;;0,045976;;0,045142
167;5.080.751;5,080751;192,168,100,98;104,22,1,235;TCP;54;56807  >  443 [FIN, ACK] Seq=1070 Ack=1026 Win=130560 Len=0;;;5,080751;5,126727;;0,045976;;0,032025;;0,013951
168;5.126.727;5,126727;192,168,100,98;104,22,1,235;TCP;66;56808  >  443 [SYN] Seq=0 Win=64240 Len=0 MSS=1460 WS=256 SACK_PERM=1;;;5,126727;5,158752;;0,032025;;0,047473;;0,015448
169;5.158.752;5,158752;104,22,1,235;192,168,100,98;TCP;56;443  >  56807 [ACK] Seq=1026 Ack=1071 Win=68608 Len=0;;;5,158752;5,206225;;0,047473;;0,000218;;0,047255
170;5.206.225;5,206225;104,22,1,235;192,168,100,98;TCP;66;443  >  56808 [SYN, ACK] Seq=0 Ack=1 Win=65535 Len=0 MSS=1400 SACK_PERM=1 WS=1024;;;5,206225;5,206443;;0,000218;;0,000839;;0,000621
171;5.206.443;5,206443;192,168,100,98;104,22,1,235;TCP;54;56808  >  443 [ACK] Seq=1 Ack=1 Win=131584 Len=0;;;5,206443;5,207282;;0,000839;;0,066135;;0,065296
172;5.207.282;5,207282;192,168,100,98;104,22,1,235;TLSv1;372;Client Hello;;;5,207282;5,273417;;0,066135;;0,012855;;0,05328
173;5.273.417;5,273417;104,22,1,235;192,168,100,98;TCP;54;443  >  56808 [ACK] Seq=1 Ack=319 Win=67584 Len=0;;;5,273417;5,286272;;0,012855;;0,001886;;0,010969
174;5.286.272;5,286272;104,22,1,235;192,168,100,98;TLSv1;177;Server Hello, Change Cipher Spec, Encrypted Handshake Message;;;5,286272;5,288158;;0,001886;;0,037005;;0,035119
175;5.288.158;5,288158;192,168,100,98;104,22,1,235;TLSv1;699;Change Cipher Spec, Encrypted Handshake Message, Application Data, Application Data;;;5,288158;5,325163;;0,037005;;0,000159;;0,036846
176;5.325.163;5,325163;192,168,100,98;74,125,68,91;TLSv1,2;187;Application Data;;;5,325163;5,325322;;0,000159;;0,022933;;0,022774
177;5.325.322;5,325322;192,168,100,98;74,125,68,91;TLSv1,2;734;Application Data;;;5,325322;5,348255;;0,022933;;0,000125;;0,022808
178;5.348.255;5,348255;104,22,1,235;192,168,100,98;TCP;56;443  >  56808 [ACK] Seq=124 Ack=964 Win=68608 Len=0;;;5,348255;5,34838;;0,000125;;0,024921;;0,024796
179;5.348.380;5,34838;192,168,100,98;104,22,1,235;TLSv1;160;Application Data, Application Data;;;5,34838;5,373301;;0,024921;;0,000204;;0,024717
180;5.373.301;5,373301;74,125,68,91;192,168,100,98;TCP;56;443  >  56441 [ACK] Seq=181 Ack=963 Win=1651 Len=0;;;5,373301;5,373505;;0,000204;;0,000903;;0,000699
181;5.373.505;5,373505;74,125,68,91;192,168,100,98;TCP;56;443  >  56441 [ACK] Seq=181 Ack=1643 Win=1662 Len=0;;;5,373505;5,374408;;0,000903;;0;;0,000903
182;5.374.408;5,374408;74,125,68,91;192,168,100,98;TLSv1,2;127;Application Data;;;5,374408;5,374408;;0;;0,000139;;0,000139
183;5.374.408;5,374408;74,125,68,91;192,168,100,98;TLSv1,2;116;Application Data;;;5,374408;5,374547;;0,000139;;0,017403;;0,017264
184;5.374.547;5,374547;192,168,100,98;74,125,68,91;TCP;54;56441  >  443 [ACK] Seq=1643 Ack=316 Win=4133 Len=0;;;5,374547;5,39195;;0,017403;;0;;0,017403
185;5.391.950;5,39195;74,125,68,91;192,168,100,98;TLSv1,2;85;Application Data;;;5,39195;5,39195;;0;;0,000184;;0,000184
186;5.391.950;5,39195;74,125,68,91;192,168,100,98;TLSv1,2;93;Application Data;;;5,39195;5,392134;;0,000184;;0,000864;;0,00068
187;5.392.134;5,392134;192,168,100,98;74,125,68,91;TCP;54;56441  >  443 [ACK] Seq=1643 Ack=386 Win=4133 Len=0;;;5,392134;5,392998;;0,000864;;0,013625;;0,012761
188;5.392.998;5,392998;192,168,100,98;74,125,68,91;TLSv1,2;93;Application Data;;;5,392998;5,406623;;0,013625;;0,005916;;0,007709
189;5.406.623;5,406623;104,22,1,235;192,168,100,98;TCP;56;443  >  56808 [ACK] Seq=124 Ack=1070 Win=68608 Len=0;;;5,406623;5,412539;;0,005916;;0,223824;;0,217908
190;5.412.539;5,412539;74,125,68,91;192,168,100,98;TCP;56;443  >  56441 [ACK] Seq=386 Ack=1682 Win=1662 Len=0;;;5,412539;5,636363;;0,223824;;0,000101;;0,223723
191;5.636.363;5,636363;104,22,1,235;192,168,100,98;TCP;54;[TCP Previous segment not captured] 443  >  56808 [FIN, ACK] Seq=1025 Ack=1070 Win=68608 Len=0;;;5,636363;5,636464;;0,000101;;0,009836;;0,009735
192;5.636.464;5,636464;192,168,100,98;104,22,1,235;TCP;54;[TCP Dup ACK 175#1] 56808  >  443 [ACK] Seq=1070 Ack=124 Win=131328 Len=0;;;5,636464;5,6463;;0,009836;;0,000181;;0,009655
193;5.646.300;5,6463;104,22,1,235;192,168,100,98;TCP;955;[TCP Out-Of-Order] 443  >  56808 [PSH, ACK] Seq=124 Ack=1070 Win=68608 Len=901;;;5,6463;5,646481;;0,000181;;0,000797;;0,000616
194;5.646.481;5,646481;192,168,100,98;104,22,1,235;TCP;54;56808  >  443 [ACK] Seq=1070 Ack=1026 Win=130560 Len=0;;;5,646481;5,647278;;0,000797;;0,04715;;0,046353
195;5.647.278;5,647278;192,168,100,98;104,22,1,235;TCP;54;56808  >  443 [FIN, ACK] Seq=1070 Ack=1026 Win=130560 Len=0;;;5,647278;5,694428;;0,04715;;0,027296;;0,019854
196;5.694.428;5,694428;104,22,1,235;192,168,100,98;TCP;56;443  >  56808 [ACK] Seq=1026 Ack=1071 Win=68608 Len=0;;;5,694428;5,721724;;0,027296;;0,052898;;0,025602
197;5.721.724;5,721724;192,168,100,98;104,22,1,235;TCP;66;56809  >  443 [SYN] Seq=0 Win=64240 Len=0 MSS=1460 WS=256 SACK_PERM=1;;;5,721724;5,774622;;0,052898;;0,000245;;0,052653
198;5.774.622;5,774622;104,22,1,235;192,168,100,98;TCP;66;443  >  56809 [SYN, ACK] Seq=0 Ack=1 Win=65535 Len=0 MSS=1400 SACK_PERM=1 WS=1024;;;5,774622;5,774867;;0,000245;;0,000866;;0,000621
199;5.774.867;5,774867;192,168,100,98;104,22,1,235;TCP;54;56809  >  443 [ACK] Seq=1 Ack=1 Win=131584 Len=0;;;5,774867;5,775733;;0,000866;;0,051878;;0,051012
200;5.775.733;5,775733;192,168,100,98;104,22,1,235;TLSv1;372;Client Hello;;;5,775733;5,827611;;0,051878;;0,019637;;0,032241
201;5.827.611;5,827611;104,22,1,235;192,168,100,98;TCP;54;443  >  56809 [ACK] Seq=1 Ack=319 Win=67584 Len=0;;;5,827611;5,847248;;0,019637;;0,002453;;0,017184
202;5.847.248;5,847248;104,22,1,235;192,168,100,98;TLSv1;177;Server Hello, Change Cipher Spec, Encrypted Handshake Message;;;5,847248;5,849701;;0,002453;;0,052887;;0,050434
203;5.849.701;5,849701;192,168,100,98;104,22,1,235;TLSv1;699;Change Cipher Spec, Encrypted Handshake Message, Application Data, Application Data;;;5,849701;5,902588;;0,052887;;0,000101;;0,052786
204;5.902.588;5,902588;104,22,1,235;192,168,100,98;TCP;56;443  >  56809 [ACK] Seq=124 Ack=964 Win=68608 Len=0;;;5,902588;5,902689;;0,000101;;0,276052;;0,275951
205;5.902.689;5,902689;192,168,100,98;104,22,1,235;TLSv1;160;Application Data, Application Data;;;5,902689;6,178741;;0,276052;;0,060574;;0,215478
206;6.178.741;6,178741;192,168,100,98;104,22,1,235;TCP;160;[TCP Retransmission] 56809  >  443 [PSH, ACK] Seq=964 Ack=124 Win=131328 Len=106;;;6,178741;6,239315;;0,060574;;0,094487;;0,033913
207;6.239.315;6,239315;104,22,1,235;192,168,100,98;TCP;56;443  >  56809 [ACK] Seq=124 Ack=1070 Win=68608 Len=0;;;6,239315;6,333802;;0,094487;;0,027507;;0,06698
208;6.333.802;6,333802;192,168,100,98;103,208,137,6;TCP;55;55911  >  443 [ACK] Seq=1 Ack=1 Win=512 Len=1 [TCP segment of a reassembled PDU];;;6,333802;6,361309;;0,027507;;0,117142;;0,089635
209;6.361.309;6,361309;103,208,137,6;192,168,100,98;TCP;66;443  >  55911 [ACK] Seq=1 Ack=2 Win=501 Len=0 SLE=1 SRE=2;;;6,361309;6,478451;;0,117142;;0,0001;;0,117042
210;6.478.451;6,478451;104,22,1,235;192,168,100,98;TCP;54;[TCP Previous segment not captured] 443  >  56809 [FIN, ACK] Seq=1025 Ack=1070 Win=68608 Len=0;;;6,478451;6,478551;;0,0001;;0,018039;;0,017939
211;6.478.551;6,478551;192,168,100,98;104,22,1,235;TCP;54;[TCP Dup ACK 203#1] 56809  >  443 [ACK] Seq=1070 Ack=124 Win=131328 Len=0;;;6,478551;6,49659;;0,018039;;0,000168;;0,017871
212;6.496.590;6,49659;104,22,1,235;192,168,100,98;TCP;955;[TCP Out-Of-Order] 443  >  56809 [PSH, ACK] Seq=124 Ack=1070 Win=68608 Len=901;;;6,49659;6,496758;;0,000168;;0,000733;;0,000565
213;6.496.758;6,496758;192,168,100,98;104,22,1,235;TCP;54;56809  >  443 [ACK] Seq=1070 Ack=1026 Win=130560 Len=0;;;6,496758;6,497491;;0,000733;;0,101851;;0,101118
214;6.497.491;6,497491;192,168,100,98;104,22,1,235;TCP;54;56809  >  443 [FIN, ACK] Seq=1070 Ack=1026 Win=130560 Len=0;;;6,497491;6,599342;;0,101851;;9,50E-05;;0,101756
215;6.599.342;6,599342;104,22,1,235;192,168,100,98;TCP;54;[TCP Retransmission] 443  >  56809 [FIN, ACK] Seq=1025 Ack=1070 Win=68608 Len=0;;;6,599342;6,599437;;9,50E-05;;0,004974;;0,004879
216;6.599.437;6,599437;192,168,100,98;104,22,1,235;TCP;54;[TCP Dup ACK 213#1] 56809  >  443 [ACK] Seq=1071 Ack=1026 Win=130560 Len=0;;;6,599437;6,604411;;0,004974;;0,053747;;0,048773
217;6.604.411;6,604411;192,168,100,98;104,22,1,235;TCP;66;56810  >  443 [SYN] Seq=0 Win=64240 Len=0 MSS=1460 WS=256 SACK_PERM=1;;;6,604411;6,658158;;0,053747;;0,000204;;0,053543
218;6.658.158;6,658158;104,22,1,235;192,168,100,98;TCP;66;443  >  56810 [SYN, ACK] Seq=0 Ack=1 Win=65535 Len=0 MSS=1400 SACK_PERM=1 WS=1024;;;6,658158;6,658362;;0,000204;;0,000963;;0,000759
219;6.658.362;6,658362;192,168,100,98;104,22,1,235;TCP;54;56810  >  443 [ACK] Seq=1 Ack=1 Win=131584 Len=0;;;6,658362;6,659325;;0,000963;;0,051627;;0,050664
220;6.659.325;6,659325;192,168,100,98;104,22,1,235;TLSv1;372;Client Hello;;;6,659325;6,710952;;0,051627;;0,020219;;0,031408
221;6.710.952;6,710952;104,22,1,235;192,168,100,98;TCP;54;443  >  56810 [ACK] Seq=1 Ack=319 Win=67584 Len=0;;;6,710952;6,731171;;0,020219;;0,001228;;0,018991
222;6.731.171;6,731171;104,22,1,235;192,168,100,98;TLSv1;177;Server Hello, Change Cipher Spec, Encrypted Handshake Message;;;6,731171;6,732399;;0,001228;;0,054433;;0,053205
223;6.732.399;6,732399;192,168,100,98;104,22,1,235;TLSv1;699;Change Cipher Spec, Encrypted Handshake Message, Application Data, Application Data;;;6,732399;6,786832;;0,054433;;0,000118;;0,054315
224;6.786.832;6,786832;104,22,1,235;192,168,100,98;TCP;56;443  >  56810 [ACK] Seq=124 Ack=964 Win=68608 Len=0;;;6,786832;6,78695;;0,000118;;0,011489;;0,011371
225;6.786.950;6,78695;192,168,100,98;104,22,1,235;TLSv1;160;Application Data, Application Data;;;6,78695;6,798439;;0,011489;;0,041218;;0,029729
226;6.798.439;6,798439;192,168,100,98;104,22,1,235;TCP;54;[TCP Retransmission] 56809  >  443 [FIN, ACK] Seq=1070 Ack=1026 Win=130560 Len=0;;;6,798439;6,839657;;0,041218;;0,010816;;0,030402
227;6.839.657;6,839657;104,22,1,235;192,168,100,98;TCP;56;443  >  56810 [ACK] Seq=124 Ack=1070 Win=68608 Len=0;;;6,839657;6,850473;;0,010816;;0,217293;;0,206477
228;6.850.473;6,850473;104,22,1,235;192,168,100,98;TCP;56;443  >  56809 [ACK] Seq=1026 Ack=1071 Win=68608 Len=0;;;6,850473;7,067766;;0,217293;;0,000101;;0,217192
229;7.067.766;7,067766;104,22,1,235;192,168,100,98;TCP;54;[TCP Previous segment not captured] 443  >  56810 [FIN, ACK] Seq=1025 Ack=1070 Win=68608 Len=0;;;7,067766;7,067867;;0,000101;;0,009395;;0,009294
230;7.067.867;7,067867;192,168,100,98;104,22,1,235;TCP;54;[TCP Dup ACK 223#1] 56810  >  443 [ACK] Seq=1070 Ack=124 Win=131328 Len=0;;;7,067867;7,077262;;0,009395;;0,000173;;0,009222
231;7.077.262;7,077262;104,22,1,235;192,168,100,98;TCP;955;[TCP Out-Of-Order] 443  >  56810 [PSH, ACK] Seq=124 Ack=1070 Win=68608 Len=901;;;7,077262;7,077435;;0,000173;;0,000834;;0,000661
232;7.077.435;7,077435;192,168,100,98;104,22,1,235;TCP;54;56810  >  443 [ACK] Seq=1070 Ack=1026 Win=130560 Len=0;;;7,077435;7,078269;;0,000834;;0,060607;;0,059773
233;7.078.269;7,078269;192,168,100,98;104,22,1,235;TCP;54;56810  >  443 [FIN, ACK] Seq=1070 Ack=1026 Win=130560 Len=0;;;7,078269;7,138876;;0,060607;;0,004397;;0,05621
234;7.138.876;7,138876;192,168,100,98;104,22,1,235;TCP;66;56811  >  443 [SYN] Seq=0 Win=64240 Len=0 MSS=1460 WS=256 SACK_PERM=1;;;7,138876;7,143273;;0,004397;;0,054732;;0,050335
235;7.143.273;7,143273;104,22,1,235;192,168,100,98;TCP;56;443  >  56810 [ACK] Seq=1026 Ack=1071 Win=68608 Len=0;;;7,143273;7,198005;;0,054732;;0,000244;;0,054488
236;7.198.005;7,198005;104,22,1,235;192,168,100,98;TCP;66;443  >  56811 [SYN, ACK] Seq=0 Ack=1 Win=65535 Len=0 MSS=1400 SACK_PERM=1 WS=1024;;;7,198005;7,198249;;0,000244;;0,000938;;0,000694
237;7.198.249;7,198249;192,168,100,98;104,22,1,235;TCP;54;56811  >  443 [ACK] Seq=1 Ack=1 Win=131584 Len=0;;;7,198249;7,199187;;0,000938;;0,070737;;0,069799
238;7.199.187;7,199187;192,168,100,98;104,22,1,235;TLSv1;372;Client Hello;;;7,199187;7,269924;;0,070737;;0,016568;;0,054169
239;7.269.924;7,269924;104,22,1,235;192,168,100,98;TCP;54;443  >  56811 [ACK] Seq=1 Ack=319 Win=67584 Len=0;;;7,269924;7,286492;;0,016568;;0,002229;;0,014339
240;7.286.492;7,286492;104,22,1,235;192,168,100,98;TLSv1;177;Server Hello, Change Cipher Spec, Encrypted Handshake Message;;;7,286492;7,288721;;0,002229;;0,060419;;0,05819
241;7.288.721;7,288721;192,168,100,98;104,22,1,235;TLSv1;699;Change Cipher Spec, Encrypted Handshake Message, Application Data, Application Data;;;7,288721;7,34914;;0,060419;;0,000118;;0,060301
242;7.349.140;7,34914;104,22,1,235;192,168,100,98;TCP;56;443  >  56811 [ACK] Seq=124 Ack=964 Win=68608 Len=0;;;7,34914;7,349258;;0,000118;;0,066978;;0,06686
243;7.349.258;7,349258;192,168,100,98;104,22,1,235;TLSv1;160;Application Data, Application Data;;;7,349258;7,416236;;0,066978;;0,226721;;0,159743
244;7.416.236;7,416236;104,22,1,235;192,168,100,98;TCP;56;443  >  56811 [ACK] Seq=124 Ack=1070 Win=68608 Len=0;;;7,416236;7,642957;;0,226721;;9,90E-05;;0,226622
245;7.642.957;7,642957;104,22,1,235;192,168,100,98;TCP;54;[TCP Previous segment not captured] 443  >  56811 [FIN, ACK] Seq=1025 Ack=1070 Win=68608 Len=0;;;7,642957;7,643056;;9,90E-05;;0,013361;;0,013262
246;7.643.056;7,643056;192,168,100,98;104,22,1,235;TCP;54;[TCP Dup ACK 241#1] 56811  >  443 [ACK] Seq=1070 Ack=124 Win=131328 Len=0;;;7,643056;7,656417;;0,013361;;0,000185;;0,013176
247;7.656.417;7,656417;104,22,1,235;192,168,100,98;TCP;955;[TCP Out-Of-Order] 443  >  56811 [PSH, ACK] Seq=124 Ack=1070 Win=68608 Len=901;;;7,656417;7,656602;;0,000185;;0,000614;;0,000429
248;7.656.602;7,656602;192,168,100,98;104,22,1,235;TCP;54;56811  >  443 [ACK] Seq=1070 Ack=1026 Win=130560 Len=0;;;7,656602;7,657216;;0,000614;;0,053301;;0,052687
249;7.657.216;7,657216;192,168,100,98;104,22,1,235;TCP;54;56811  >  443 [FIN, ACK] Seq=1070 Ack=1026 Win=130560 Len=0;;;7,657216;7,710517;;0,053301;;0,012956;;0,040345
250;7.710.517;7,710517;104,22,1,235;192,168,100,98;TCP;56;443  >  56811 [ACK] Seq=1026 Ack=1071 Win=68608 Len=0;;;7,710517;7,723473;;0,012956;;0,013536;;0,00058
251;7.723.473;7,723473;192,168,100,98;104,22,1,235;TCP;66;56812  >  443 [SYN] Seq=0 Win=64240 Len=0 MSS=1460 WS=256 SACK_PERM=1;;;7,723473;7,737009;;0,013536;;0,005182;;0,008354
252;7.737.009;7,737009;192,168,100,98;36,92,238,236;TLSv1,2;1375;Application Data;;;7,737009;7,742191;;0,005182;;0,001107;;0,004075
253;7.742.191;7,742191;36,92,238,236;192,168,100,98;TCP;54;443  >  56638 [ACK] Seq=1 Ack=1322 Win=504 Len=0;;;7,742191;7,743298;;0,001107;;0,000192;;0,000915
254;7.743.298;7,743298;36,92,238,236;192,168,100,98;TLSv1,2;2878;Application Data;;;7,743298;7,74349;;0,000192;;0,000427;;0,000235
